{
  "api_version": "1.0",
  "schema_version": "1.0",
  "intent": {
    "purpose": "code_understanding",
    "details": "Locate the authority implementation and the nearest callers for my.app.order/process-order."
  },
  "targets": {
    "symbols": ["my.app.order/process-order"],
    "paths": ["src/my/app/order.clj"]
  },
  "constraints": {
    "token_budget": 1800,
    "language_allowlist": ["clojure"],
    "allowed_path_prefixes": ["src/", "test/"],
    "max_raw_code_level": "enclosing_unit",
    "freshness": "current_snapshot"
  },
  "hints": {
    "preferred_paths": ["src/my/app/order.clj", "test/my/app/order_test.clj"],
    "preferred_modules": ["my.app.order"],
    "suspected_symbols": ["my.app.order/process-order"],
    "focus_on_tests": true,
    "prefer_definitions_over_callers": true,
    "prefer_breadth_over_depth": false
  },
  "options": {
    "include_tests": true,
    "include_impact_hints": true,
    "allow_raw_code_escalation": false
  },
  "trace": {
    "trace_id": "11111111-1111-4111-8111-111111111111",
    "request_id": "req-symbol-target-001",
    "task_id": "task-order-debug-001",
    "actor_id": "planner_agent"
  }
}
